{
  "schema_version": 1,
  "packet_kind": "schema_fixture",
  "packet_id": "linux-appimage-schema-fixture",
  "observed_at_utc": "2000-01-01T00:00:00Z",
  "release": {
    "repository": "TheGreenCedar/BatCave",
    "tag": "v0.0.0-evidence.1",
    "channel": "prerelease",
    "source_sha": "4444444444444444444444444444444444444444",
    "main_sha": "4444444444444444444444444444444444444444",
    "release_target_sha": "4444444444444444444444444444444444444444",
    "release_url": "https://github.com/TheGreenCedar/BatCave/releases/tag/v0.0.0-evidence.1",
    "workflow_run": {
      "workflow_file": ".github/workflows/release.yml",
      "run_id": 900000004,
      "run_attempt": 1,
      "url": "https://github.com/TheGreenCedar/BatCave/actions/runs/900000004/attempts/1"
    }
  },
  "platform": {
    "support_contract_version": 1,
    "profile_id": "ubuntu-22.04-x86_64-glibc",
    "proof": {
      "declaration": "declared",
      "source": "pending",
      "native": "pending"
    },
    "os": "linux",
    "os_version": "synthetic-linux-fixture",
    "architecture": "x86_64",
    "runtime": {
      "libc_family": "glibc"
    },
    "package": {
      "kind": "appimage",
      "architecture": "x86_64",
      "asset_name": "BatCave.Monitor_0.0.0-evidence.1_amd64.AppImage"
    }
  },
  "assets": [
    {
      "name": "BatCave.Monitor_0.0.0-evidence.1_amd64.AppImage",
      "size_bytes": 1000004,
      "sha256": "sha256:4444444444444444444444444444444444444444444444444444444444444444",
      "api_digest": "sha256:4444444444444444444444444444444444444444444444444444444444444444",
      "public_url": "https://github.com/TheGreenCedar/BatCave/releases/download/v0.0.0-evidence.1/BatCave.Monitor_0.0.0-evidence.1_amd64.AppImage",
      "attestation": {
        "verified": true,
        "repository": "TheGreenCedar/BatCave",
        "source_sha": "4444444444444444444444444444444444444444",
        "source_ref": "refs/heads/main",
        "signer_workflow": "TheGreenCedar/BatCave/.github/workflows/release.yml"
      },
      "signatures": {
        "tauri_updater": {
          "identity": "synthetic updater key fingerprint fixture",
          "verified": true
        }
      }
    }
  ],
  "checks": {
    "install": {
      "anonymous_download": {
        "status": "not_applicable",
        "outcome": "Synthetic schema fixture only."
      },
      "checksum": {
        "status": "not_applicable",
        "outcome": "Synthetic schema fixture only."
      },
      "package_install": {
        "status": "not_applicable",
        "outcome": "Synthetic schema fixture only."
      }
    },
    "runtime": {
      "degradation": {
        "status": "not_applicable",
        "outcome": "Synthetic schema fixture only."
      },
      "launch": {
        "status": "not_applicable",
        "outcome": "Synthetic schema fixture only."
      },
      "release_identity": {
        "status": "not_applicable",
        "outcome": "Synthetic schema fixture only."
      },
      "settings": {
        "status": "not_applicable",
        "outcome": "Synthetic schema fixture only."
      },
      "telemetry": {
        "status": "not_applicable",
        "outcome": "Synthetic schema fixture only."
      }
    },
    "cleanup": {
      "application_removed": {
        "status": "not_applicable",
        "outcome": "Synthetic schema fixture only."
      },
      "owned_runtime_cleanup": {
        "status": "not_applicable",
        "outcome": "Synthetic schema fixture only."
      },
      "user_state_policy": {
        "status": "not_applicable",
        "outcome": "Synthetic schema fixture only."
      }
    }
  },
  "limitations": {
    "synthetic_fixture_no_release_claim": {
      "disposition": "not_applicable",
      "summary": "Schema exercise only; this packet is not release evidence."
    }
  }
}
