{
  "schema_version": 1,
  "packet_kind": "schema_fixture",
  "packet_id": "linux-deb-schema-fixture",
  "observed_at_utc": "2000-01-01T00:00:00Z",
  "release": {
    "repository": "TheGreenCedar/BatCave",
    "tag": "v0.0.0-evidence.1",
    "channel": "prerelease",
    "source_sha": "1111111111111111111111111111111111111111",
    "main_sha": "1111111111111111111111111111111111111111",
    "release_target_sha": "1111111111111111111111111111111111111111",
    "release_url": "https://github.com/TheGreenCedar/BatCave/releases/tag/v0.0.0-evidence.1",
    "workflow_run": {
      "workflow_file": ".github/workflows/release.yml",
      "run_id": 900000001,
      "run_attempt": 1,
      "url": "https://github.com/TheGreenCedar/BatCave/actions/runs/900000001/attempts/1"
    }
  },
  "platform": {
    "support_contract_version": 1,
    "profile_id": "debian-12-x86_64-glibc",
    "proof": {
      "declaration": "declared",
      "source": "pending",
      "native": "pending"
    },
    "os": "linux",
    "os_version": "synthetic-linux-fixture",
    "architecture": "x86_64",
    "runtime": {
      "libc_family": "glibc"
    },
    "package": {
      "kind": "deb",
      "architecture": "x86_64",
      "asset_name": "BatCave.Monitor_0.0.0-evidence.1_amd64.deb"
    }
  },
  "assets": [
    {
      "name": "BatCave.Monitor_0.0.0-evidence.1_amd64.deb",
      "size_bytes": 1000002,
      "sha256": "sha256:2222222222222222222222222222222222222222222222222222222222222222",
      "api_digest": "sha256:2222222222222222222222222222222222222222222222222222222222222222",
      "public_url": "https://github.com/TheGreenCedar/BatCave/releases/download/v0.0.0-evidence.1/BatCave.Monitor_0.0.0-evidence.1_amd64.deb",
      "attestation": {
        "verified": true,
        "repository": "TheGreenCedar/BatCave",
        "source_sha": "1111111111111111111111111111111111111111",
        "source_ref": "refs/heads/main",
        "signer_workflow": "TheGreenCedar/BatCave/.github/workflows/release.yml"
      },
      "signatures": {}
    }
  ],
  "checks": {
    "install": {
      "anonymous_download": {
        "status": "not_applicable",
        "outcome": "Synthetic schema fixture only."
      },
      "checksum": {
        "status": "not_applicable",
        "outcome": "Synthetic schema fixture only."
      },
      "package_install": {
        "status": "not_applicable",
        "outcome": "Synthetic schema fixture only."
      }
    },
    "runtime": {
      "degradation": {
        "status": "not_applicable",
        "outcome": "Synthetic schema fixture only."
      },
      "launch": {
        "status": "not_applicable",
        "outcome": "Synthetic schema fixture only."
      },
      "release_identity": {
        "status": "not_applicable",
        "outcome": "Synthetic schema fixture only."
      },
      "settings": {
        "status": "not_applicable",
        "outcome": "Synthetic schema fixture only."
      },
      "telemetry": {
        "status": "not_applicable",
        "outcome": "Synthetic schema fixture only."
      }
    },
    "cleanup": {
      "application_removed": {
        "status": "not_applicable",
        "outcome": "Synthetic schema fixture only."
      },
      "owned_runtime_cleanup": {
        "status": "not_applicable",
        "outcome": "Synthetic schema fixture only."
      },
      "user_state_policy": {
        "status": "not_applicable",
        "outcome": "Synthetic schema fixture only."
      }
    }
  },
  "limitations": {
    "deb_checksum_attestation_only": {
      "disposition": "not_applicable",
      "summary": "Debian trust uses the public checksum and source-bound attestation."
    },
    "synthetic_fixture_no_release_claim": {
      "disposition": "not_applicable",
      "summary": "Schema exercise only; this packet is not release evidence."
    }
  }
}
