{
  "schema_version": 1,
  "packet_kind": "schema_fixture",
  "packet_id": "windows-nsis-schema-fixture",
  "observed_at_utc": "2000-01-01T00:00:00Z",
  "release": {
    "repository": "TheGreenCedar/BatCave",
    "tag": "v0.0.0-evidence.1",
    "channel": "prerelease",
    "source_sha": "1111111111111111111111111111111111111111",
    "main_sha": "1111111111111111111111111111111111111111",
    "release_target_sha": "1111111111111111111111111111111111111111",
    "release_url": "https://github.com/TheGreenCedar/BatCave/releases/tag/v0.0.0-evidence.1",
    "workflow_run": {
      "workflow_file": ".github/workflows/release.yml",
      "run_id": 900000001,
      "run_attempt": 1,
      "url": "https://github.com/TheGreenCedar/BatCave/actions/runs/900000001/attempts/1"
    }
  },
  "platform": {
    "support_contract_version": 1,
    "profile_id": "windows-client-10-x86_64",
    "proof": {
      "declaration": "declared",
      "source": "pending",
      "native": "pending"
    },
    "os": "windows",
    "os_version": "synthetic-windows-fixture",
    "architecture": "x86_64",
    "runtime": {
      "libc_family": "not_applicable"
    },
    "package": {
      "kind": "nsis",
      "architecture": "x86_64",
      "asset_name": "BatCave.Monitor_0.0.0-evidence.1_x64-setup.exe"
    }
  },
  "assets": [
    {
      "name": "BatCave.Monitor_0.0.0-evidence.1_x64-setup.exe",
      "size_bytes": 1000001,
      "sha256": "sha256:1111111111111111111111111111111111111111111111111111111111111111",
      "api_digest": "sha256:1111111111111111111111111111111111111111111111111111111111111111",
      "public_url": "https://github.com/TheGreenCedar/BatCave/releases/download/v0.0.0-evidence.1/BatCave.Monitor_0.0.0-evidence.1_x64-setup.exe",
      "attestation": {
        "verified": true,
        "repository": "TheGreenCedar/BatCave",
        "source_sha": "1111111111111111111111111111111111111111",
        "source_ref": "refs/heads/main",
        "signer_workflow": "TheGreenCedar/BatCave/.github/workflows/release.yml"
      },
      "signatures": {
        "authenticode": {
          "identity": "synthetic Authenticode signer fixture",
          "verified": true,
          "subject": "synthetic Authenticode subject fixture",
          "rfc3161_timestamp_utc": "2000-01-01T00:00:00Z",
          "files": [
            {
              "name": "BatCave.Monitor_0.0.0-evidence.1_x64-setup.exe",
              "sha256": "sha256:1111111111111111111111111111111111111111111111111111111111111111",
              "disposition": "generated_signed",
              "original_sha256": null,
              "subject": "synthetic Authenticode subject fixture",
              "certificate_sha256": "sha256:1111111111111111111111111111111111111111111111111111111111111111",
              "rfc3161_timestamp_utc": "2000-01-01T00:00:00Z",
              "verified": true
            }
          ]
        },
        "tauri_updater": {
          "identity": "synthetic updater key fingerprint fixture",
          "verified": true
        }
      }
    }
  ],
  "checks": {
    "install": {
      "anonymous_download": {
        "status": "not_applicable",
        "outcome": "Synthetic schema fixture only."
      },
      "checksum": {
        "status": "not_applicable",
        "outcome": "Synthetic schema fixture only."
      },
      "package_install": {
        "status": "not_applicable",
        "outcome": "Synthetic schema fixture only."
      }
    },
    "runtime": {
      "degradation": {
        "status": "not_applicable",
        "outcome": "Synthetic schema fixture only."
      },
      "launch": {
        "status": "not_applicable",
        "outcome": "Synthetic schema fixture only."
      },
      "release_identity": {
        "status": "not_applicable",
        "outcome": "Synthetic schema fixture only."
      },
      "settings": {
        "status": "not_applicable",
        "outcome": "Synthetic schema fixture only."
      },
      "telemetry": {
        "status": "not_applicable",
        "outcome": "Synthetic schema fixture only."
      }
    },
    "cleanup": {
      "application_removed": {
        "status": "not_applicable",
        "outcome": "Synthetic schema fixture only."
      },
      "owned_runtime_cleanup": {
        "status": "not_applicable",
        "outcome": "Synthetic schema fixture only."
      },
      "user_state_policy": {
        "status": "not_applicable",
        "outcome": "Synthetic schema fixture only."
      }
    }
  },
  "limitations": {
    "synthetic_fixture_no_release_claim": {
      "disposition": "not_applicable",
      "summary": "Schema exercise only; this packet is not release evidence."
    }
  }
}
